{
  "template_id": "BJT-CC-02",
  "metadata_version": "v3.0.0",
  "physical_template_ref": {
    "template_file": "bjt_cc_voltage_divider_bias_nocout_buffer.json",
    "template_sha256": "b9463c26bad71645794aa84e61eb4e7f5d372587e81456422c02d07be561d25a",
    "kicanvas_compatible": true
  },
  "domain": {
    "category": "bjt",
    "family": "common_collector",
    "topology_tags": [
      "common_collector",
      "voltage_divider",
      "no_output_cap"
    ],
    "target_use_cases": [
      "impedance_matching",
      "output_buffer"
    ]
  },
  "functional_structure": {
    "ports": {
      "external_inputs": [
        {
          "name": "VIN",
          "role": "signal_in",
          "polarity": "single_ended"
        }
      ],
      "external_outputs": [
        {
          "name": "VOUT",
          "role": "signal_out",
          "polarity": "single_ended"
        }
      ],
      "supply_ports": [
        {
          "name": "VCC",
          "role": "supply",
          "polarity": "n/a"
        },
        {
          "name": "GND",
          "role": "ground",
          "polarity": "n/a"
        }
      ]
    },
    "blocks": [
      {
        "id": "stage1",
        "type": "cc_block",
        "inputs": [
          "VIN"
        ],
        "outputs": [
          "VOUT"
        ],
        "internal_components": [
          "Q1",
          "R1",
          "R2",
          "RE",
          "CIN"
        ],
        "gain_formula": "RE / (re + RE) ≈ 1",
        "roles": [
          "buffering",
          "impedance_matching"
        ]
      }
    ],
    "connections": [],
    "pattern_signature": {
      "ordered_block_types": [
        "cc_block"
      ],
      "graph_hash": "ce7a808cd199c149",
      "motifs": []
    },
    "total_gain_formula": "RE / (re + RE) ≈ 1",
    "stage_count": 1
  },
  "planner_hints": {
    "intent_keys": [
      "emitter follower",
      "common collector",
      "buffer",
      "CC"
    ],
    "required_capabilities": [
      "buffering",
      "low_output_impedance"
    ],
    "optional_capabilities": [],
    "priority_score": 0.85,
    "fallback_rank": 2,
    "compatible_extensions": []
  },
  "solver_hints": {
    "parameters": [
      {
        "name": "r1_resistance",
        "symbol": "R1",
        "component_ref": "R1",
        "component_type": "resistor",
        "adjustable": true,
        "range": {
          "min": 100,
          "max": 1000000,
          "unit": "ohm"
        },
        "preferred_series": "E24"
      },
      {
        "name": "r2_resistance",
        "symbol": "R2",
        "component_ref": "R2",
        "component_type": "resistor",
        "adjustable": true,
        "range": {
          "min": 100,
          "max": 1000000,
          "unit": "ohm"
        },
        "preferred_series": "E24"
      },
      {
        "name": "re_resistance",
        "symbol": "RE",
        "component_ref": "RE",
        "component_type": "resistor",
        "adjustable": true,
        "range": {
          "min": 100,
          "max": 1000000,
          "unit": "ohm"
        },
        "preferred_series": "E24"
      }
    ],
    "equations": [
      {
        "id": "eq_gain",
        "expression": "RE / (re + RE) ≈ 1",
        "variables": [
          "R1",
          "R2",
          "RE"
        ]
      }
    ],
    "constraints": [
      {
        "name": "vce_active",
        "rule": "VCE > 0.2V",
        "severity": "hard"
      },
      {
        "name": "power_dissipation",
        "rule": "P_Q < P_max",
        "severity": "hard"
      }
    ],
    "optimization_targets": []
  },
  "validation": {
    "domain_rules": [
      "all_required_ports_connected",
      "valid_supply_domain"
    ],
    "min_checks": [
      "gain_equation_satisfiable"
    ],
    "known_limitations": []
  },
  "sync": {
    "source_template_last_modified": "2026-02-12T09:40:10Z",
    "metadata_last_modified": "2026-02-12T09:40:10Z",
    "status": "in_sync"
  }
}