{
  "template_id": "BJT-CE-03",
  "metadata_version": "v3.0.0",
  "physical_template_ref": {
    "template_file": "bjt_ce_fixed_bias_degen_amplifier.json",
    "template_sha256": "5054f72d2b8fee78e85d24eab50e454a26b7d8e0c0226f83635d0a9ec9b7432a",
    "kicanvas_compatible": true
  },
  "domain": {
    "category": "bjt",
    "family": "common_emitter",
    "topology_tags": [
      "common_emitter",
      "fixed_bias",
      "emitter_degeneration"
    ],
    "target_use_cases": [
      "audio_preamp",
      "general_amplification"
    ]
  },
  "functional_structure": {
    "ports": {
      "external_inputs": [
        {
          "name": "VIN",
          "role": "signal_in",
          "polarity": "single_ended"
        }
      ],
      "external_outputs": [
        {
          "name": "VOUT",
          "role": "signal_out",
          "polarity": "single_ended"
        }
      ],
      "supply_ports": [
        {
          "name": "VCC",
          "role": "supply",
          "polarity": "n/a"
        },
        {
          "name": "GND",
          "role": "ground",
          "polarity": "n/a"
        }
      ]
    },
    "blocks": [
      {
        "id": "stage1",
        "type": "ce_block",
        "inputs": [
          "VIN"
        ],
        "outputs": [
          "VOUT"
        ],
        "internal_components": [
          "Q1",
          "R1",
          "RC",
          "RE",
          "CIN",
          "COUT"
        ],
        "gain_formula": "-RC / (re + RE)",
        "roles": [
          "amplification"
        ]
      }
    ],
    "connections": [],
    "pattern_signature": {
      "ordered_block_types": [
        "ce_block"
      ],
      "graph_hash": "949b7c694b699f08",
      "motifs": []
    },
    "total_gain_formula": "-RC / (re + RE)",
    "stage_count": 1
  },
  "planner_hints": {
    "intent_keys": [
      "common emitter",
      "CE amplifier",
      "bjt amplifier",
      "voltage amplifier"
    ],
    "required_capabilities": [
      "voltage_gain"
    ],
    "optional_capabilities": [
      "cc_block"
    ],
    "priority_score": 0.9,
    "fallback_rank": 3,
    "compatible_extensions": [
      "cc_block"
    ]
  },
  "solver_hints": {
    "parameters": [
      {
        "name": "r1_resistance",
        "symbol": "R1",
        "component_ref": "R1",
        "component_type": "resistor",
        "adjustable": true,
        "range": {
          "min": 100,
          "max": 1000000,
          "unit": "ohm"
        },
        "preferred_series": "E24"
      },
      {
        "name": "rc_resistance",
        "symbol": "RC",
        "component_ref": "RC",
        "component_type": "resistor",
        "adjustable": true,
        "range": {
          "min": 100,
          "max": 1000000,
          "unit": "ohm"
        },
        "preferred_series": "E24"
      },
      {
        "name": "re_resistance",
        "symbol": "RE",
        "component_ref": "RE",
        "component_type": "resistor",
        "adjustable": true,
        "range": {
          "min": 100,
          "max": 1000000,
          "unit": "ohm"
        },
        "preferred_series": "E24"
      }
    ],
    "equations": [
      {
        "id": "eq_gain",
        "expression": "-RC / (re + RE)",
        "variables": [
          "R1",
          "RC",
          "RE"
        ]
      }
    ],
    "constraints": [
      {
        "name": "vce_active",
        "rule": "VCE > 0.2V",
        "severity": "hard"
      },
      {
        "name": "power_dissipation",
        "rule": "P_Q < P_max",
        "severity": "hard"
      }
    ],
    "optimization_targets": [
      "gain_accuracy"
    ]
  },
  "validation": {
    "domain_rules": [
      "all_required_ports_connected",
      "valid_supply_domain"
    ],
    "min_checks": [
      "gain_equation_satisfiable"
    ],
    "known_limitations": [
      "phase_inverted_output"
    ]
  },
  "sync": {
    "source_template_last_modified": "2026-02-12T09:40:09Z",
    "metadata_last_modified": "2026-02-12T09:40:09Z",
    "status": "in_sync"
  }
}