{
  "template_id": "BJT-CB-03",
  "metadata_version": "v3.0.0",
  "physical_template_ref": {
    "template_file": "bjt_cb_fixed_bias_bypass_amplifier.json",
    "template_sha256": "cda337095a00efc76053e901c1e94a2134ecbb3ece973e53fa19a8e511678df8",
    "kicanvas_compatible": true
  },
  "domain": {
    "category": "bjt",
    "family": "common_base",
    "topology_tags": [
      "common_base",
      "fixed_bias",
      "bypassed"
    ],
    "target_use_cases": [
      "rf_preamp",
      "wideband_amplifier"
    ]
  },
  "functional_structure": {
    "ports": {
      "external_inputs": [
        {
          "name": "VIN",
          "role": "signal_in",
          "polarity": "single_ended"
        }
      ],
      "external_outputs": [
        {
          "name": "VOUT",
          "role": "signal_out",
          "polarity": "single_ended"
        }
      ],
      "supply_ports": [
        {
          "name": "VCC",
          "role": "supply",
          "polarity": "n/a"
        },
        {
          "name": "GND",
          "role": "ground",
          "polarity": "n/a"
        }
      ]
    },
    "blocks": [
      {
        "id": "stage1",
        "type": "cb_block",
        "inputs": [
          "VIN"
        ],
        "outputs": [
          "VOUT"
        ],
        "internal_components": [
          "Q1",
          "RC",
          "RE",
          "R1",
          "CBYP",
          "CIN",
          "COUT"
        ],
        "gain_formula": "RC / re",
        "roles": [
          "amplification",
          "current_buffer"
        ]
      }
    ],
    "connections": [],
    "pattern_signature": {
      "ordered_block_types": [
        "cb_block"
      ],
      "graph_hash": "1ee020ec714f08db",
      "motifs": []
    },
    "total_gain_formula": "RC / re",
    "stage_count": 1
  },
  "planner_hints": {
    "intent_keys": [
      "common base",
      "CB amplifier",
      "wideband",
      "rf preamp"
    ],
    "required_capabilities": [
      "voltage_gain",
      "low_input_impedance"
    ],
    "optional_capabilities": [
      "cc_block"
    ],
    "priority_score": 0.8,
    "fallback_rank": 3,
    "compatible_extensions": [
      "cc_block"
    ]
  },
  "solver_hints": {
    "parameters": [
      {
        "name": "rc_resistance",
        "symbol": "RC",
        "component_ref": "RC",
        "component_type": "resistor",
        "adjustable": true,
        "range": {
          "min": 100,
          "max": 1000000,
          "unit": "ohm"
        },
        "preferred_series": "E24"
      },
      {
        "name": "re_resistance",
        "symbol": "RE",
        "component_ref": "RE",
        "component_type": "resistor",
        "adjustable": true,
        "range": {
          "min": 100,
          "max": 1000000,
          "unit": "ohm"
        },
        "preferred_series": "E24"
      },
      {
        "name": "r1_resistance",
        "symbol": "R1",
        "component_ref": "R1",
        "component_type": "resistor",
        "adjustable": true,
        "range": {
          "min": 100,
          "max": 1000000,
          "unit": "ohm"
        },
        "preferred_series": "E24"
      }
    ],
    "equations": [
      {
        "id": "eq_gain",
        "expression": "RC / re",
        "variables": [
          "RC",
          "RE",
          "R1"
        ]
      }
    ],
    "constraints": [
      {
        "name": "vce_active",
        "rule": "VCE > 0.2V",
        "severity": "hard"
      },
      {
        "name": "power_dissipation",
        "rule": "P_Q < P_max",
        "severity": "hard"
      }
    ],
    "optimization_targets": [
      "bandwidth"
    ]
  },
  "validation": {
    "domain_rules": [
      "all_required_ports_connected",
      "valid_supply_domain"
    ],
    "min_checks": [
      "gain_equation_satisfiable"
    ],
    "known_limitations": []
  },
  "sync": {
    "source_template_last_modified": "2026-02-12T09:40:10Z",
    "metadata_last_modified": "2026-02-12T09:40:10Z",
    "status": "in_sync"
  }
}